[
  {
    "code": "AUD",
    "name": "Australian Dollar",
    "symbol": "$",
    "updatedAt": "2026-06-05"
  },
  {
    "code": "BRL",
    "name": "Brazilian Real",
    "symbol": "R$",
    "updatedAt": "2026-06-05"
  },
  {
    "code": "CAD",
    "name": "Canadian Dollar",
    "symbol": "$",
    "updatedAt": "2026-06-05"
  },
  {
    "code": "CNY",
    "name": "Chinese Yuan",
    "symbol": "¥",
    "updatedAt": "2026-06-05"
  },
  {
    "code": "EUR",
    "name": "Euro",
    "symbol": "€",
    "updatedAt": "2026-06-05"
  },
  {
    "code": "GBP",
    "name": "British Pound Sterling",
    "symbol": "£",
    "updatedAt": "2026-06-05"
  },
  {
    "code": "INR",
    "name": "Indian Rupee",
    "symbol": "₹",
    "updatedAt": "2026-06-05"
  },
  {
    "code": "JPY",
    "name": "Japanese Yen",
    "symbol": "¥",
    "updatedAt": "2026-06-05"
  },
  {
    "code": "USD",
    "name": "United States Dollar",
    "symbol": "$",
    "updatedAt": "2026-06-05"
  }
]
